{
  "task_id": "smoke-git",
  "task_type": "research",
  "execution_mode": "single-worker",
  "write_policy": "read-only",
  "origin": {"controller": "codex", "workflow_stage": "research"},
  "workdir": "/tmp/ccollab-git-smoke",
  "objective": "Exercise the git-aware runtime path.",
  "context_summary": "Installed-launcher smoke task for Git-aware execution.",
  "inputs": {
    "files": [],
    "constraints": [],
    "acceptance_criteria": ["Persist a task result artifact"],
    "verification_commands": [],
    "closeout": {"on_success": "archived", "on_failure": "inspection-required"}
  },
  "claude_role": {
    "mode": "research",
    "allow_subagents": false,
    "model": "sonnet",
    "timeout_seconds": 60
  }
}
