{
  "task_id": "example-research",
  "task_type": "research",
  "execution_mode": "single-worker",
  "write_policy": "read-only",
  "origin": {"controller": "codex", "workflow_stage": "research"},
  "workdir": "/tmp/project",
  "objective": "Research the target",
  "context_summary": "Example research request",
  "inputs": {
    "files": [],
    "constraints": [],
    "acceptance_criteria": ["Return findings"],
    "verification_commands": [],
    "closeout": {"on_success": "archived", "on_failure": "inspection-required"}
  },
  "claude_role": {"mode": "research", "allow_subagents": false}
}
